{
  "id": "nantes-sortie-ilebeaulieu",
  "title": "Sortie sur l'Île de Beaulieu",
  "description": "Séance d'hypnose en bord de l'Erdre. Ambiance conviviale et détendue.",
  "date_start": "2026-08-22",
  "date_end": "2026-08-22",
  "lat": 47.2184,
  "lng": -1.5554,
  "city": "Nantes",
  "link": "https://www.hypnosekinky.com/",
  "status": "published"
}
