{
  "id": "marseille-spectacle-vieuxport",
  "title": "Spectacle au Vieux-Port",
  "description": "Démonstration publique d'hypnose sur le Vieux-Port. Entrée libre.",
  "date_start": "2026-10-05",
  "date_end": "2026-10-05",
  "lat": 43.2965,
  "lng": 5.3698,
  "city": "Marseille",
  "link": "https://www.hypnosekinky.com/",
  "status": "published"
}
