{
  "id": "bordeaux-atelier-gardeyne",
  "title": "Atelier au Jardin Public",
  "description": "Atelier de découverte de l'hypnose en plein air. Places limitées, pensez à arriver en avance.",
  "date_start": "2026-08-15",
  "date_end": null,
  "lat": 44.8378,
  "lng": -0.5792,
  "city": "Bordeaux",
  "link": null,
  "image": "https://i.imgur.com/86tyrlu.jpeg",
  "status": "published"
}
