{
  "id": "paris-atelier-decouverte",
  "title": "Atelier Découverte — Hypnose de Rue",
  "description": "Une séance d'initiation à l'hypnose en plein air, ouverte à tous. Apportez votre bonne humeur et un plaid si vous le souhaitez.",
  "date_start": "2026-09-12",
  "date_end": "2026-09-12",
  "lat": 48.8606,
  "lng": 2.3376,
  "city": "Paris",
  "link": "https://www.hypnosekinky.com/",
  "status": "published"
}
