{
  "id": "lyon-sortie-parc",
  "title": "Sortie au Parc de la Tête d'Or",
  "description": "Hypnose de rue dans le cadre verdoyant du parc. Rencontre à l'entrée principale.",
  "date_start": "2026-09-20",
  "date_end": null,
  "lat": 45.7696,
  "lng": 4.8522,
  "city": "Lyon",
  "link": null,
  "status": "published"
}
